<?xml version="1.0"?>
<!DOCTYPE YogaConfigGroup SYSTEM "YogaConfigGroup.dtd">
<YogaConfigGroup>
	<!--  1  -->
	<YogaConfig>
		<Description>Moon in Aswini</Description>
		<Effect>The person born In Aswini will be fond of decoration, handsome, popular, skilful and intelligent </Effect>
		<Source>Brihat Jataka</Source><Group>Nakshatra position</Group>
		<AllowHigherVargas>false</AllowHigherVargas>
		<Rule>return getNakshatra( Moon ) == Aswini;</Rule>
	</YogaConfig>

	<!--  2  -->
	<YogaConfig>
		<Description>Moon in Bharani</Description>
		<Effect>One born in Bharani will be determined, truthful, healthy, skilful and happy.</Effect>
		<Source>Brihat Jataka</Source><Group>Nakshatra position</Group>
		<AllowHigherVargas>false</AllowHigherVargas>
		<Rule>return getNakshatra( Moon ) == Bharani;</Rule>
	</YogaConfig>

	<!--  3  -->
	<YogaConfig>
		<Description>Moon in Krittika</Description>
		<Effect>The person born in Krittika will be a voracious enter, fond of otherâ€™s wives, attractive and renowned </Effect>
		<Source>Brihat Jataka</Source><Group>Nakshatra position</Group>
		<AllowHigherVargas>false</AllowHigherVargas>
		<Rule>return getNakshatra( Moon ) == Krittika;</Rule>
	</YogaConfig>

	<!--  4  -->
	<YogaConfig>
		<Description>Moon in Rohini</Description>
		<Effect>Rohini makes a man truthful, clean, following religious and moral principles, sweet in speech, fixed mind and handsome.</Effect>
		<Source>Brihat Jataka</Source><Group>Nakshatra position</Group>
		<AllowHigherVargas>false</AllowHigherVargas>
		<Rule>return getNakshatra( Moon ) == Rohini;</Rule>
	</YogaConfig>

	<!--  5  -->
	<YogaConfig>
		<Description>Moon in Mrigasira</Description>
		<Effect>Mrigasira-Capricious, skilful, cowardly, good speaker, hopeful, rich and enjoying.</Effect>
		<Source>Brihat Jataka</Source><Group>Nakshatra position</Group>
		<AllowHigherVargas>false</AllowHigherVargas>
		<Rule>return getNakshatra( Moon ) == Mrigasira;</Rule>
	</YogaConfig>

	<!--  6  -->
	<YogaConfig>
		<Description>Moon in Arudra</Description>
		<Effect>Aridra-Dissimulating in self-interest, proud, ungrateful, cruel and sinful.</Effect>
		<Source>Brihat Jataka</Source><Group>Nakshatra position</Group>
		<AllowHigherVargas>false</AllowHigherVargas>
		<Rule>return getNakshatra( Moon ) == Arudra;</Rule>
	</YogaConfig>

	<!--  7  -->
	<YogaConfig>
		<Description>Moon in Punarvasu</Description>
		<Effect>Punarvasu-Religious endurance, happy, good, dull, sickly, thirsty and pleased with small gifts.</Effect>
		<Source>Brihat Jataka</Source><Group>Nakshatra position</Group>
		<AllowHigherVargas>false</AllowHigherVargas>
		<Rule>return getNakshatra( Moon ) == Punarvasu;</Rule>
	</YogaConfig>

	<!--  8  -->
	<YogaConfig>
		<Description>Moon in Pushyami</Description>
		<Effect>Pushya-Control over passions, popular, learned, rich and charitable.</Effect>
		<Source>Brihat Jataka</Source><Group>Nakshatra position</Group>
		<AllowHigherVargas>false</AllowHigherVargas>
		<Rule>return getNakshatra( Moon ) == Pushyami;</Rule>
	</YogaConfig>

	<!--  9  -->
	<YogaConfig>
		<Description>Moon in Aslesha</Description>
		<Effect>Aslesha-Dissimulator, clever in selfishness, sinful, ungrateful and a cheat.</Effect>
		<Source>Brihat Jataka</Source><Group>Nakshatra position</Group>
		<AllowHigherVargas>false</AllowHigherVargas>
		<Rule>return getNakshatra( Moon ) == Aslesha;</Rule>
	</YogaConfig>

	<!--  10  -->
	<YogaConfig>
		<Description>Moon in Makha</Description>
		<Effect>Makha-Many servants and great wealth, enjoying, respector of elders and gods and very enterprising.</Effect>
		<Source>Brihat Jataka</Source><Group>Nakshatra position</Group>
		<AllowHigherVargas>false</AllowHigherVargas>
		<Rule>return getNakshatra( Moon ) == Makha;</Rule>
	</YogaConfig>

	<!--  11  -->
	<YogaConfig>
		<Description>Moon in Purva Phalgini</Description>
		<Effect>Pubba-Sweet speech, liberal, handsome, fond of traveling and royal servant.</Effect>
		<Source>Brihat Jataka</Source><Group>Nakshatra position</Group>
		<AllowHigherVargas>false</AllowHigherVargas>
		<Rule>return getNakshatra( Moon ) == PurvaPhalgini;</Rule>
	</YogaConfig>

	<!--  12  -->
	<YogaConfig>
		<Description>Moon in Uttara Phalguni</Description>
		<Effect>Uttara-Popular, self-acquired property, enjoying and happy.</Effect>
		<Source>Brihat Jataka</Source><Group>Nakshatra position</Group>
		<AllowHigherVargas>false</AllowHigherVargas>
		<Rule>return getNakshatra( Moon ) == UttaraPhalguni;</Rule>
	</YogaConfig>

	<!--  13  -->
	<YogaConfig>
		<Description>Moon in Hashta</Description>
		<Effect>Hasta-Enterprising, intelligent or (shameless), drunkard, cruel and thievish.</Effect>
		<Source>Brihat Jataka</Source><Group>Nakshatra position</Group>
		<AllowHigherVargas>false</AllowHigherVargas>
		<Rule>return getNakshatra( Moon ) == Hashta;</Rule>
	</YogaConfig>

	<!--  14  -->
	<YogaConfig>
		<Description>Moon in Chitta</Description>
		<Effect>Chitta-Using various clothes and garlands, good looks and limbs.</Effect>
		<Source>Brihat Jataka</Source><Group>Nakshatra position</Group>
		<AllowHigherVargas>false</AllowHigherVargas>
		<Rule>return getNakshatra( Moon ) == Chitta;</Rule>
	</YogaConfig>

	<!--  15  -->
	<YogaConfig>
		<Description>Moon in Swati</Description>
		<Effect>Swati-Polite, merchant, kind hearted, not able to endure thirst, sweet tongued and generous.</Effect>
		<Source>Brihat Jataka</Source><Group>Nakshatra position</Group>
		<AllowHigherVargas>false</AllowHigherVargas>
		<Rule>return getNakshatra( Moon ) == Swati;</Rule>
	</YogaConfig>

	<!--  16  -->
	<YogaConfig>
		<Description>Moon in Vishakha</Description>
		<Effect>Visakha-Jealous, avaricious, handsome, clever speaker and quarrelsome, or maker of money.</Effect>
		<Source>Brihat Jataka</Source><Group>Nakshatra position</Group>
		<AllowHigherVargas>false</AllowHigherVargas>
		<Rule>return getNakshatra( Moon ) == Vishakha;</Rule>
	</YogaConfig>

	<!--  17  -->
	<YogaConfig>
		<Description>Moon in Anuradha</Description>
		<Effect>Anuradha-Master or chief, living in foreign countries, not able to bear hunger and fond of traveling.</Effect>
		<Source>Brihat Jataka</Source><Group>Nakshatra position</Group>
		<AllowHigherVargas>false</AllowHigherVargas>
		<Rule>return getNakshatra( Moon ) == Anuradha;</Rule>
	</YogaConfig>

	<!--  18  -->
	<YogaConfig>
		<Description>Moon in Jeshta</Description>
		<Effect>Jyeshta-Few friends, contented, charitable, very irritable.</Effect>
		<Source>Brihat Jataka</Source><Group>Nakshatra position</Group>
		<AllowHigherVargas>false</AllowHigherVargas>
		<Rule>return getNakshatra( Moon ) == Jeshta;</Rule>
	</YogaConfig>

	<!--  19  -->
	<YogaConfig>
		<Description>Moon in Moola</Description>
		<Effect>Moola-Proud, rich happy, good, steady and enjoying.</Effect>
		<Source>Brihat Jataka</Source><Group>Nakshatra position</Group>
		<AllowHigherVargas>false</AllowHigherVargas>
		<Rule>return getNakshatra( Moon ) == Moola;</Rule>
	</YogaConfig>

	<!--  20  -->
	<YogaConfig>
		<Description>Moon in Purva Shadha</Description>
		<Effect>Purvashada-Good and pleasant wife, proud and a steady friend.</Effect>
		<Source>Brihat Jataka</Source><Group>Nakshatra position</Group>
		<AllowHigherVargas>false</AllowHigherVargas>
		<Rule>return getNakshatra( Moon ) == PurvaShadha;</Rule>
	</YogaConfig>

	<!--  21  -->
	<YogaConfig>
		<Description>Moon in UttaraShadha</Description>
		<Effect>Uttarashada-Polite, knowing, virtuous, many friends, grateful and popular.</Effect>
		<Source>Brihat Jataka</Source><Group>Nakshatra position</Group>
		<AllowHigherVargas>false</AllowHigherVargas>
		<Rule>return getNakshatra( Moon ) == UttaraShadha;</Rule>
	</YogaConfig>

	<!--  22  -->
	<YogaConfig>
		<Description>Moon in Sravana</Description>
		<Effect>Sravana-Rich surroundings, learned, good and liberal or liberal to wife, wealthy and renowned.</Effect>
		<Source>Brihat Jataka</Source><Group>Nakshatra position</Group>
		<AllowHigherVargas>false</AllowHigherVargas>
		<Rule>return getNakshatra( Moon ) == Sravana;</Rule>
	</YogaConfig>

	<!--  23  -->
	<YogaConfig>
		<Description>Moon in Dhanishta</Description>
		<Effect>Dhanishta-Liberal, rich, courageous, fond of music and money.</Effect>
		<Source>Brihat Jataka</Source><Group>Nakshatra position</Group>
		<AllowHigherVargas>false</AllowHigherVargas>
		<Rule>return getNakshatra( Moon ) == Dhanishta;</Rule>
	</YogaConfig>

	<!--  24  -->
	<YogaConfig>
		<Description>Moon in Satabishak</Description>
		<Effect>Satabhisha-Plain and truthful, striken from sorrow through females, etc., killer of enemies, adventurous and irreconcilable.</Effect>
		<Source>Brihat Jataka</Source><Group>Nakshatra position</Group>
		<AllowHigherVargas>false</AllowHigherVargas>
		<Rule>return getNakshatra( Moon ) == Satabishak;</Rule>
	</YogaConfig>

	<!--  25  -->
	<YogaConfig>
		<Description>Moon in Purva Bhadra</Description>
		<Effect>Poorvabhadra-Sorrowful, loss of money through females, skilful and miserly.</Effect>
		<Source>Brihat Jataka</Source><Group>Nakshatra position</Group>
		<AllowHigherVargas>false</AllowHigherVargas>
		<Rule>return getNakshatra( Moon ) == PurvaBhadra;</Rule>
	</YogaConfig>

	<!--  26  -->
	<YogaConfig>
		<Description>Moon in Uttara Bhadra</Description>
		<Effect>Uttarabhadra-Good and witty speaker in society and meetings, happy, many children and grandchildren, successful over enemies and charitable.</Effect>
		<Source>Brihat Jataka</Source><Group>Nakshatra position</Group>
		<AllowHigherVargas>false</AllowHigherVargas>
		<Rule>return getNakshatra( Moon ) == UttaraBhadra;</Rule>
	</YogaConfig>

	<!--  27  -->
	<YogaConfig>
		<Description>Moon in Revati</Description>
		<Effect>Revati-Well- developed organs, popular, courageous, clean and wealthy. developed organs, popular, courageous, clean and wealthy.</Effect>
		<Source>Brihat Jataka</Source><Group>Nakshatra position</Group>
		<AllowHigherVargas>false</AllowHigherVargas>
		<Rule>return getNakshatra( Moon ) == Revati;</Rule>
	</YogaConfig>

</YogaConfigGroup>
